{
  "@context": [
    "https://www.w3.org/2018/credentials/v1",
    "http://localhost:8443/docs/did.schema.html"
  ],
  "id": "did:batterypass:eu",
  "verificationMethod": {
    "id": "did:batterypass:eu#key-1",
    "type": "JsonWebKey2020",
    "controller": "did:batterypass:eu",
    "publicKeyMultibase": "-----BEGIN PUBLIC KEY-----\nMFkwEwYHKoZIzj0CAQYIKoZIzj0DAQcDQgAEQrlJgSc0Idu6NJz8sBnuWtBFePqmRUxO8thHlQn4yp+JFaGChLxcO9yEs90Edu7+ShMDON3FRdQmh/tx0y6dvQ==\n-----END PUBLIC KEY-----"
  },
  "timestamp": "2006-01-02T15:04:05Z",
  "revoked": false
}